{
  "schemaVersion": "1.0.0",
  "runId": "run:39805e6cacad839063818cc0a3cf7f8b27855ae4ca62162c919f258beb026bdb",
  "analysisRoots": ["example.org"],
  "candidates": [
    {
      "id": "domain-affinity:3e4c1f707cd1eeae0d375c37154a16cef6f90fc82cebf515043eb7236f45ce1a",
      "candidateDomain": "example.com",
      "analysisRoots": ["example.org"],
      "reason": "Evento DNS_NAME fuera de las raíces analizadas; distancia y etiqueta affiliate solo priorizan la revisión, sin afirmar propiedad.",
      "ruleId": "domain-affinity.external-registrable-domain",
      "ruleVersion": "1.0.0",
      "score": 2,
      "evidence": [
        {
          "eventId": "event-child-example",
          "eventType": "DNS_NAME",
          "locator": "/events/1",
          "observedAt": "2026-10-18T00:00:00.000Z",
          "scopeDistance": 1,
          "affiliateTagged": true
        }
      ]
    }
  ]
}
